{
  "created_at": "2026-07-17T16:47:46Z",
  "owner_skill": "creator-workspace-manager",
  "privacy_class": "publishable_template",
  "schema_version": "0.4.0",
  "surfaces": [
    {
      "archive_policy": "retain",
      "mutable": true,
      "owner_skill": "creator-workspace-manager",
      "path": ".creator/workspace.json",
      "privacy_class": "publishable_template",
      "required": true,
      "schema": "schemas/workspace/workspace.schema.json",
      "surface_id": "workspace"
    },
    {
      "archive_policy": "retain",
      "mutable": true,
      "owner_skill": "creator-workspace-manager",
      "path": ".creator/projects.json",
      "privacy_class": "repository_workflow_state",
      "required": true,
      "schema": "schemas/workspace/projects.schema.json",
      "surface_id": "projects"
    },
    {
      "archive_policy": "retain",
      "mutable": true,
      "owner_skill": "creator-workspace-manager",
      "path": ".creator/entities.json",
      "privacy_class": "private",
      "required": true,
      "schema": "schemas/workspace/entities.schema.json",
      "surface_id": "entities"
    },
    {
      "archive_policy": "retain",
      "mutable": true,
      "owner_skill": "creator-workspace-manager",
      "path": ".creator/state.json",
      "privacy_class": "repository_workflow_state",
      "required": true,
      "schema": "schemas/workspace/state.schema.json",
      "surface_id": "state"
    },
    {
      "archive_policy": "retain",
      "mutable": true,
      "owner_skill": "creator-workspace-manager",
      "path": ".creator/session-insights.json",
      "privacy_class": "private",
      "required": true,
      "schema": "schemas/workspace/session-insights.schema.json",
      "surface_id": "session-insights"
    },
    {
      "archive_policy": "retain",
      "mutable": true,
      "owner_skill": "creator-workspace-manager",
      "path": ".creator/operator.json",
      "privacy_class": "private",
      "required": true,
      "schema": "schemas/workspace/operator.schema.json",
      "surface_id": "operator"
    },
    {
      "archive_policy": "retain",
      "mutable": true,
      "owner_skill": "creator-workspace-manager",
      "path": ".creator/backlog.json",
      "privacy_class": "repository_workflow_state",
      "required": true,
      "schema": "schemas/workspace/backlog.schema.json",
      "surface_id": "backlog"
    },
    {
      "archive_policy": "retain",
      "mutable": true,
      "owner_skill": "creator-workspace-manager",
      "path": ".creator/surfaces.json",
      "privacy_class": "publishable_template",
      "required": true,
      "schema": "schemas/workspace/surfaces.schema.json",
      "surface_id": "surfaces"
    },
    {
      "archive_policy": "retain",
      "mutable": true,
      "owner_skill": "creator-workspace-manager",
      "path": ".creator/decisions.json",
      "privacy_class": "repository_workflow_state",
      "required": true,
      "schema": "schemas/workspace/decisions.schema.json",
      "surface_id": "decisions"
    },
    {
      "archive_policy": "retain",
      "mutable": true,
      "owner_skill": "creator-rule-router",
      "path": ".creator/rules.json",
      "privacy_class": "repository_contract",
      "required": true,
      "schema": "schemas/workspace/rules.schema.json",
      "surface_id": "rules"
    }
  ],
  "updated_at": "2026-07-17T16:47:46Z"
}
